{
  "judul_utama": "Analisis daya saing harga retail & margin bengkel Q3 2026 vs Q2 2026",
  "cakupan": "Multizona",
  "periode": "Q3 2026 vs Q2 2026",
  "ringkasan_eksekutif": [
    "Enduro Matic-S 0.8L dan Fastron EcoGreen 5W-30 tetap unggul harga pada Q3 dengan Gap HJ nasional −Rp 9.390/L dan −Rp 19.349/L [Survey Response Report Retail, Q3 2026].",
    "Meditran SC 15W-40 menjadi satu-satunya Hero berstatus KRITIS dengan Gap HJ nasional +Rp 666/L, tertekan di Zona 1 (+Rp 1.793/L) dan Zona 2 (+Rp 6.300/L).",
    "Zona 3 mencatat keunggulan harga EcoGreen 5W-30 paling lebar, −Rp 28.207/L."
  ],
  "kpi_zona": [
    {"judul": "Nasional (Average)", "subjudul": "Rerata RI", "metrik": [
      {"label": "Enduro Matic-S Gap HJ", "nilai": "−9.390/L", "arah": "baik"},
      {"label": "Fastron EcoGreen Gap HJ", "nilai": "−19.349/L", "arah": "baik"},
      {"label": "Meditran SC 15W-40 Gap HJ", "nilai": "+666/L", "arah": "buruk"},
      {"label": "Matic-S Margin PTPL", "nilai": "Rp 10.596/L", "arah": "netral"}],
     "catatan": "Tekanan utama Meditran SC berada di Zona 1–2."},
    {"judul": "Zona 1 (Region 3, 4, 5)", "subjudul": "Jawa-Nusra", "metrik": [
      {"label": "Enduro Matic-S Gap HJ", "nilai": "−9.656/L", "arah": "baik"},
      {"label": "Fastron EcoGreen Gap HJ", "nilai": "−9.327/L", "arah": "baik"},
      {"label": "Meditran SC 15W-40 Gap HJ", "nilai": "+1.793/L", "arah": "buruk"},
      {"label": "Matic-S Margin PTPL", "nilai": "Rp 10.912/L", "arah": "netral"}]},
    {"judul": "Zona 2 (Region 2, 6)", "subjudul": "Sumatra-Kaltim", "metrik": [
      {"label": "Enduro Matic-S Gap HJ", "nilai": "−9.487/L", "arah": "baik"},
      {"label": "Fastron EcoGreen Gap HJ", "nilai": "−18.457/L", "arah": "baik"},
      {"label": "Meditran SC 15W-40 Gap HJ", "nilai": "+6.300/L", "arah": "buruk"},
      {"label": "Matic-S Margin PTPL", "nilai": "Rp 9.337/L", "arah": "netral"}]},
    {"judul": "Zona 3 (Region 1, 7)", "subjudul": "Sumut & Timur", "metrik": [
      {"label": "Enduro Matic-S Gap HJ", "nilai": "−8.874/L", "arah": "baik"},
      {"label": "Fastron EcoGreen Gap HJ", "nilai": "−28.207/L", "arah": "baik"},
      {"label": "Meditran SC 15W-40 Gap HJ", "nilai": "−6.837/L", "arah": "baik"},
      {"label": "Matic-S Margin PTPL", "nilai": "Rp 10.782/L", "arah": "netral"}],
     "catatan": "EcoGreen menjadi price advantage paling lebar."}
  ],
  "matriks": {
    "kolom": [
      {"nama": "Gap HJ Nasional", "arah_baik": "negatif"}, {"nama": "Gap Marg Nasional", "arah_baik": "positif"},
      {"nama": "Gap HJ Zona 1", "arah_baik": "negatif"}, {"nama": "Gap Marg Zona 1", "arah_baik": "positif"},
      {"nama": "Gap HJ Zona 2", "arah_baik": "negatif"}, {"nama": "Gap Marg Zona 2", "arah_baik": "positif"},
      {"nama": "Gap HJ Zona 3", "arah_baik": "negatif"}, {"nama": "Gap Marg Zona 3", "arah_baik": "positif"},
      {"nama": "Status", "arah_baik": "netral"}],
    "baris": [
      {"label": "MCO · Motor Cycle Oil", "jenis": "grup", "nilai": ["", "", "", "", "", "", "", "", ""]},
      {"label": "MCO 10W-30 (Viscosity Avg)", "jenis": "biasa", "nilai": ["−12.592", "+83", "−12.329", "+166", "−12.909", "−91", "−13.055", "−150", "AMAN"]},
      {"label": "▸ ENDURO MATIC-S 0.8L (Hero)", "jenis": "hero", "nilai": ["−9.390", "−385", "−9.656", "−396", "−9.487", "−637", "−8.874", "−394", "AMAN"]},
      {"label": "PCO · Passenger Car Oil", "jenis": "grup", "nilai": ["", "", "", "", "", "", "", "", ""]},
      {"label": "▸ FASTRON ECOGREEN 5W-30 3.5L (Hero)", "jenis": "hero", "nilai": ["−19.349", "−6.226", "−9.327", "−2.019", "−18.457", "−7.825", "−28.207", "−9.940", "AMAN"]},
      {"label": "Commercial · Diesel Engine Oil", "jenis": "grup", "nilai": ["", "", "", "", "", "", "", "", ""]},
      {"label": "▸ MEDITRAN SC DIESEL 15W-40 5L (Hero)", "jenis": "hero", "nilai": ["+666", "+963", "+1.793", "+307", "+6.300", "+2.474", "−6.837", "−2.430", "KRITIS"]},
      {"label": "▸ MEDITRAN S 40 5L (Hero)", "jenis": "hero", "nilai": ["−4.349", "−581", "−2.653", "−292", "−3.515", "+261", "−9.155", "−2.699", "AMAN"]}
    ],
    "catatan": "Gap HJ = HJ PTPL − HJ Komp (negatif = PTPL lebih murah). Gap Marg = Marg PTPL − Marg Komp (positif = margin PTPL lebih besar bagi bengkel)."
  },
  "grafik": [
    {"judul": "Komparasi Gap HJ per Zona", "jenis": "bar", "satuan": "IDR/L",
     "kategori": ["Matic-S", "EcoGreen 5W-30", "Meditran SC"],
     "seri": [{"nama": "Nasional", "nilai": [-9390, -19349, 666]}, {"nama": "Zona 1", "nilai": [-9656, -9327, 1793]},
              {"nama": "Zona 2", "nilai": [-9487, -18457, 6300]}, {"nama": "Zona 3", "nilai": [-8874, -28207, -6837]}],
     "catatan": "Negatif = PTPL lebih murah dari kompetitor."},
    {"judul": "Tren Gap HJ EcoGreen 5W-30 vs Shell", "jenis": "line", "satuan": "IDR/L",
     "kategori": ["Juli 2026", "Agustus 2026", "September 2026"],
     "seri": [{"nama": "Gap HJ", "nilai": [-19349, -17848, -11543]}]}
  ],
  "insight_strategis": [
    {"kategori": "I. CONSUMER VIEW · PROTEKSI DOMINASI HARGA ECERAN", "judul": "Pertahankan keunggulan eceran MCO & PCO di seluruh zona",
     "uraian": "Gap HJ nasional Enduro Matic-S −Rp 9.390/L dan Fastron EcoGreen 5W-30 −Rp 19.349/L; Matic-S berada dekat switching zone dan perlu dipantau.", "tingkat": "positif"},
    {"kategori": "II. OUTLET VIEW · MITIGASI MARGIN SQUEEZE", "judul": "Restrukturisasi acuan HTO Meditran SC 15W-40",
     "uraian": "Gap HTO Meditran SC mencapai +Rp 5.290/L di Zona 1 dan +Rp 3.380/L di Zona 2, sementara nasional +Rp 1.189/L.", "tingkat": "kritis"},
    {"kategori": "III. ANOMALI DISTRIBUSI", "judul": "Perubahan benchmark Shell Eco Plus LCGC pada Agustus–September",
     "uraian": "Gap EcoGreen 5W-30 terhadap Shell menyempit dari −Rp 17.848/L pada Agustus menjadi −Rp 11.543/L pada September.", "tingkat": "perhatian"}
  ],
  "sumber_data": "Survey Response Report Retail · Q2 2026 (Apr–Jun) vs Q3 2026 (Jul–Sep) · Standardized per liter (IDR/L) · PT Pertamina Lubricants."
}
